{
  "schema_version": "fsf_remote_profile_v1",
  "profile_id": "local_worker",
  "transport": "local",
  "authorized": false,
  "approved_recipes": [],
  "policy": {
    "cpu": 2,
    "gpu": false,
    "ram_mb": 4096,
    "disk_mb": 2048,
    "deadline_seconds": 600,
    "network_sources": [
      "https://pypi.org/simple"
    ],
    "credential_env_names": []
  },
  "settings": {
    "worker_root": "worker",
    "python": "python"
  }
}
