{
  "schema_version": "fsf_remote_profile_v1",
  "profile_id": "kaggle_worker",
  "transport": "kaggle",
  "authorized": false,
  "approved_recipes": [],
  "policy": {
    "cpu": 2,
    "gpu": false,
    "ram_mb": 4096,
    "disk_mb": 2048,
    "deadline_seconds": 600,
    "network_sources": [
      "https://pypi.org/simple"
    ],
    "credential_env_names": []
  },
  "settings": {
    "owner_env": "KAGGLE_USERNAME"
  }
}
